{
  "id": "550e8400-e29b-41d4-a716-446655440500",
  "organization_id": "550e8400-e29b-41d4-a716-446655440001",
  "project_id": "550e8400-e29b-41d4-a716-446655440400",
  "name": "Design homepage mockups",
  "is_done": false,
  "estimated_time": 28800,
  "created_at": "2026-01-06T00:00:00Z",
  "updated_at": "2026-01-09T00:00:00Z"
}
